{
  "goal": {
    "task": "Add a reset operation to the existing counter.count capability on the hello_world backend",
    "behavior": "counter.count gains a reset operation that clears every per-word count; subsequent count calls start over from 1",
    "compatibility": "backward compatible -- the existing count operation and its per-word semantics must not change",
    "test_required": "the verification harness must exercise reset and prove counts start over after it",
    "integration_required": "route it through the existing ARPAPED Bridge (sample/hello_world/backend/runtime/bridge) without modifying the Bridge's architecture"
  },
  "starting_state": "last completed cycle's published state at sample/hello_world/backend: counter.count 1.0.0 with operation count verified 23/23 and recorded as episode hello-world-e09e9222d084; catalog has 7 implementation records; verified-green verification-record.json present",
  "reusable_discovery": [
    "sample/hello_world/backend/runtime/bridge/MANIFEST.yaml (execution_boundary/registry/policy/selector/assembler)",
    "sample/hello_world/backend/runtime/app/requests.py (single request-construction point, R6/R8)",
    "sample/hello_world/backend/implementation/build_catalog.py (catalog rebuild, Phase 8)",
    "sample/hello_world/backend/implementation/contracts/counter.count.contract.yaml and its manifest/executor (exactly one contract file per capability, R2)"
  ],
  "decisions": [
    {
      "responsibility": "counter.count",
      "decision": "create",
      "reason": "Adds a backward-compatible reset operation to the existing counter.count capability; Phase 3 discovery found no registered capability anywhere providing reset/clear semantics to reuse or compose. R1 small-reusability verdict: 'clear accumulated counts' is a generic single-task operation, a natural peer of count within the same capability. Recorded per R2 as a new version peer (1.1.0: operations count + reset) in the one contract file; 1.0.0 stays a recorded, supported peer (backward compatibility), and the single implementation counter.count.default upgrades to 1.1.0.",
      "check_ids": [
        "call:7:hello_counter",
        "call:8:hello_counter",
        "call:9:hello_counter",
        "call:10:hello_counter",
        "call:11:hello_counter",
        "call:12:hello_counter",
        "call:7-12:hello_counter:in-process-persistence-and-reset"
      ]
    }
  ],
  "new_capabilities": [],
  "reused_capabilities": [],
  "registry_changes": "capability-catalog.jsonl rebuilt via build_catalog: still 7 implementation records; the counter.count.default entry updated to contract_version 1.1.0, implementation version 1.1.0, operations [count, reset] (input_schema now records both operations). assemble_from_catalog registers it into the canonical Registry at requests.py import time.",
  "bridge_integration": "Every backend call (the existing six plus hello_counter count x4 and reset x1) resolved through app/requests.py's single request-construction point and the same canonical Bridge app/main.py uses (R6/R8). The frontend greeting_render check still boots web.serve via that same resolve() and exercises the frontend's own Bridge over web.serve's /bridge endpoint. No Bridge component (bridge.py/registry.py/policy.py/selector.py/assembler.py) was modified.",
  "verification": {
    "harness": "sample/hello_world/backend/implementation/tests/verify/verify.py",
    "trace_evaluation": "All 12 backend capability-operation calls observed full Bridge traces validated -> discovered -> policy_evaluated -> selected -> executed (copied verbatim from responses), including counter.count reset (call 10); the frontend's greeting_render observed the same through its own Bridge. counter.count's six calls observed running counts [1, 2, 1, 0, 1, 1], asserting in-process persistence AND reset semantics (call:7-12:hello_counter:in-process-persistence-and-reset).",
    "failures_and_fixes": "No failures this cycle: first harness run after the reset changes passed 26/26. The previous cycle's harness-infrastructure correction (stop calling save_episode; defer to finish_cycle) remains in force.",
    "verification_record_ref": "sample/hello_world/backend/state/verification-record.json",
    "status": "verified"
  },
  "resulting_state": "sample/hello_world/backend",
  "resulting_state_ref": {
    "content_hash": "sha256:597f7e6e8952c52e3b0fe884972e71c683f369b947cacd5d1475e9c008191909",
    "vcs": {
      "system": "git",
      "commit": "9cf402d5568e527df511565d0a74b066a4e11904",
      "branch": "test/dep-real-cycle",
      "dirty": true
    }
  },
  "next_cycle_readiness": "capability-catalog.jsonl (counter.count.default@1.1.0, operations count + reset), app/dependencies.yaml (hello_counter pinned 1.1.0), runtime capabilities/counter/count/executor.py, and the green state/verification-record.json fully describe the resulting state; no private session memory is required -- the checkpoint gates resume, and the Phase 7 harness re-runs everything."
}